type,prix,surface,nb_pieces,localisation,details
Appartement,282 000 €,29.2 m²,2 pièces,75020 PARIS,"Paris 20e - Télégraphe / Votre agence Stéphane Plaza Immobilier a le plaisir de vous présenter un deux pièces baigné de lumière, en dernier étage (avec ascenseur) d'un immeuble des années 30. entrée, salle d'eau avec douche et WC, cuisine semi-ouverte sur le séjour et chambre."
Appartement,970 000 €,102.05 m²,4 pièces,75015 PARIS,"d'une entrée, un séjour, une cuisine, 3 chambres, une salle d'eau et une salle de bain, WC. Une cave et une place de parking complètent ce bien."
Appartement,540 000 €,59.71 m²,3 pièces,75020 PARIS,"Nous avons le plaisir de vous présenter un appartement plein de charme, ayant bénéficié d'une très belle rénovation. Ce bien comportant 3 pièces, dispose en premier lieu d'un confortable espace de vie (salon/séjour/cuisine) de près de 24 m2 éclairé par deux grandes fenêtres donnant sur la rue (exposition Ouest)."
Appartement,250 000 €,25.31 m²,1 pièces,75012 PARIS,"L'agence Stéphane Plaza Immobilier Paris 10 vous propose en exclusivité ce studio en rez-de-chaussée rénové de 25,31 m² loi carrez (soit 35,21 surface au sol) , à usage commercial, situé dans un bel immeuble en pierre de taille, à 250 m du métro Daumesnil. Il se compose d'une pièce de vie principale, une cuisine aménagée ouverte, une salle d'eau avec wc, d'une chambre en souplex."
Appartement,780 000 €,92 m²,4 pièces,75020 PARIS,"Quartier Alexandre Dumas, votre agence Stéphane Plaza Immobilier de Paris 20e Alexandre Dumas vous propose ce quatre pièces traversant et calme à 3 minutes du métro Alexandre Dumas (ligne 2) et 7 minutes du métro Buzenval (ligne 9) . D'une superficie de 92 m² et situé au 2ème étage avec ascenseur d'un immeuble bien entretenu."
Appartement,223 000 €,20.7 m²,1 pièces,75011 PARIS,"Immeuble ancien idéalement situé au coeur du 11e arrondissement proche des commerces et transports. Appartement en très bon état, lumineux et au calme de 20,70m2 loi carrez situé au 3e étage desservi par escalier."
Appartement,698 000 €,70.38 m²,3 pièces,75018 PARIS,"Quartier Montmartre - Jules Joffrin 1 bis rue Lecuyer Paris 18ème Amateurs de PMC (Parquet - Moulures - Cheminées), venez découvrir ce superbe appartement de 3 pièces 1 chambre (possibilité de 3 pièces 2 chambres). L'appartement comprend 2 balcons et une grande cave complète ce bien."
Appartement,599 000 €,79.11 m²,3 pièces,75020 PARIS,"Vous êtes comme moi, un rez-de -chaussée ne vous séduit pas en général ? Alors faites-moi confiance et venez découvrir celui-ci.."
Appartement,240 000 €,26.71 m²,1 pièces,75020 PARIS,"Quartier Père Lachaise-Réunion, votre agence Stéphane Plaza Immobilier de Paris 20e Alexandre Dumas vous propose ce studio lumineux et calme, d'une superficie de 26.71 m² et situé au 10ème et dernier étage avec ascenseur d'un immeuble bien entretenu."
Appartement,218 000 €,18 m²,1 pièces,75011 PARIS,"À quelques pas du métro Rue Saint-Maur, venez découvrir ce magnifique studio clés en main de 18 m² (17,58 m² loi Carrez), situé au 2e étage par escalier, dans une copropriété ancienne. Il se compose d'une entrée avec placards de rangement, d'une pièce de vie exposée sud, d'un cuisine semi-ouverte entièrement équipée, ainsi que d'une salle de bain (baignoire sabot) avec WC."
Appartement,123 000 €,18.73 m²,2 pièces,75018 PARIS,"Marx Dormoy / rue jean Robert - Au 3ème étage d'un immeuble ancien, venez visiter ce charmant 2 pièces de 18,73 m² composé d'une pièce de vie avec coin cuisine, une chambre et une salle d'eau avec WC. A deux pas des commerces et des transports."
Appartement,539 000 €,54 m²,2 pièces,75018 PARIS,"++++ COUP DE COEUR - LAMARCK-CAULAINCOURT - APPARTEMENT 2 PIECES - TERRASSE +++ Votre agence Stéphane Plaza a le plaisir de vous présenter en EXCLUSIVITE cet appartement COUP DE COEUR de 2 pièces de 54m2 pondérés (43m2 Carrez) situé dans une rue CALME, à seulement 2 minutes à pieds du métro Lamarck-Caulaincourt, et seulement 10 minutes à pieds de MONTMARTRE. Au premier étage d'un immeuble de STANDING, l'appartement se compose d'une entrée desservant, la cuisine séparée et AMENAGEE, un W."
Appartement,465 000 €,43.29 m²,2 pièces,75016 PARIS,"PARIS, au coeur du quartier de PASSY et du XVIè arrondissement, dans un endroit calme et verdoyant. Appartement au second étage avec ascenseur, 43."
Appartement,1 495 000 €,168 m²,7 pièces,75005 PARIS,"Situé à deux pas de la rue Monge, proche des métro Place Monge, Censier et Jussieu (ligne 7), cet appartement bénéficie d'un emplacement privilégié dans un secteur recherché du 5ème arrondissement, à proximité immédiate du Jardin des Plantes et de la Mosquée de Paris. Le quartier latin offre un cadre de vie agréable, calme et pratique, avec de nombreux commerces, écoles, marchés et transports à quelques minutes à pied."
Appartement,192 000 €,15.32 m²,1 pièces,75010 PARIS,"Rue de Paradis, situé au 6ème et dernier étage d'un immeuble ancien de bonne facture avec ascenseur ; Venez découvrir ce charmant studio clé en main de 15.32 m² loi carrez, composé d'une vaste pièce de vie ensoleillée offrant une vue dégagée sans vis-à-vis, avec cuisine aménagée et équipée, d'une salle d'eau avec wc."
Appartement,453 000 €,52.82 m²,2 pièces,75010 PARIS,"Exclusivité - Rue du Faubourg Saint-Martin, à la limite du 3e arrondissement et du quartier de la Mairie du 10. Au calme absolu, venez découvrir au premier étage d'un immeuble ancien ce loft de 52."
Appartement,580 000 €,79.11 m²,4 pièces,75020 PARIS,"Dans une résidence aux espaces verts privés et très bien entretenus (un des plus grands parcs privés de Paris), votre agence Stéphane Plaza Immobilier a le plaisir de vous proposer un appartement familial et modulable en fonction de vos besoins. entrée, cuisine indépendante, séjour, salon, deux chambres, une salle d'eau et un WC indépendant, il pourrait tout aussi bien disposer de 3 chambres tout en conservant un séjour/salon de près de 18 m2."
Appartement,600 000 €,75.3 m²,4 pièces,75020 PARIS,"Nous vous invitons à découvrir cet appartement familial rénové en ce tout début d'année 2025. entrée, cuisine indépendante aménagée, vaste double-séjour avec balcon (exposition Sud/Ouest), deux chambres sur jardin, salle de douche, wc indépendant et une cave."
Appartement,478 000 €,64.55 m²,3 pièces,75020 PARIS,"75020 - SAINT FARGEAU - 3 PIECES BALCON - A 350 mètres du métro, cet appartement au 3eme étage a besoin d'une seconde jeunesse. Des travaux, c'est entendu, il y en aura mais des promesses aussi car il n'a rien perdu de ses qualités intrinsèques."
Appartement,130 000 €,14.54 m²,1 pièces,75018 PARIS,"Pont Caulaincourt / rue Damrémont - Au 7ème et dernier étage d'un bel immeuble en pierres et briques, studette de 14,54 m² comprenant une pièce de vie avec coin cuisine et une salle d'eau avec WC. Calme et lumineux."
Appartement,199 000 €,26.12 m²,2 pièces,75018 PARIS,"La chapelle / rue Marx Dormoy - Sur le bâtiment cour d'un immeuble ancien fraîchement ravalé, 2 pièces de 26,12 m² composé d'une entrée, un séjour, une chambre, une cuisine (possibilité US) et une salle d'eau avec WC. Calme et lumineux."
Appartement,180 000 €,12 m²,1 pièces,75008 PARIS,"Coup de coeur assuré pour ce magnifique studio situé entièrement rénové au dernier étage d'un très bel immeuble Haussmanien. Dans le quartier recherché de Monceau, au sein d'une copropriété bien entretenue avec gardien, et parties communes de standing, ce bien rare bénéficie d'un calme absolu et d'un aperçu Tour Eiffel depuis son Velux Accessible par un escalier de service, sans vis-à-vis, il offre un cadre de vie paisible en plein coeur de Paris."
Appartement,180 000 €,12 m²,1 pièces,75008 PARIS,"Coup de coeur assuré pour ce magnifique studio entièrement rénové au dernier étage d'un très bel immeuble Haussmanien. Dans le quartier recherché de Monceau, au sein d'une copropriété bien entretenue avec gardien, et parties communes de standing, ce bien rare bénéficie d'un calme absolu et d'un aperçu Tour Eiffel depuis son Velux Accessible par un escalier de service, sans vis-à-vis, il offre un cadre de vie paisible en plein coeur de Paris."
Appartement,465 000 €,38.02 m²,2 pièces,75017 PARIS,"En NOUVEAUTE et en EXCLUSIVITE Chez Stéphane Plaza Immobilier, Charmant 2 pièces idéalement situé. Au coeur d'un quartier recherché, à deux pas du métro Porte de Champerret et des commerces, découvrez ce bel appartement de 38 m² niché dans un immeuble bien entretenu avec ascenseur."
Appartement,242 000 €,31.54 m²,2 pièces,75018 PARIS,"Château Rouge / Panama - Au sein d'un bel immeuble ancien, venez visiter ce beau 2 pièces de 31,54 m². Situé au 4ème étage du bâtiment cour, cet appartement est composé d'une entrée, une pièce de vie avec cuisine ouverte et une salle d'eau avec WC."
Appartement,300 000 €,31.76 m²,2 pièces,75015 PARIS,"d'une entrée, une cuisine aménagée et équipée ouverte sur séjour, une chambre, une salle d'eau et WC. Une cave complète ce bien."
Appartement,125 000 €,14.15 m²,1 pièces,75018 PARIS,"Mairie du 18ème / rue Letort - Au sein d'un immeuble ancien bien tenu, niché au 2ème étage, studio de 14,15 m² comprenant un coin cuisine, une pièce de vie et une salle d'eau avec WC. Fonctionnel."
Appartement,2 480 000 €,162.12 m²,5 pièces,75008 PARIS,"A deux pas du Parc MONCEAU, au 4ème étage avec ascenseur d'un bel immeuble ancien, nous vous invitons à découvrir ce magnifique appartement fonctionnel de 162 m². Une entrée avec WC séparé, un beau séjour avec 3 grandes portes fenêtres donnant accès à un beau balcon filant exposé plein Sud, une cuisine dînatoire ouverte, un dégagement desservant une suite parentale sur cour avec dressing/salle d'eau et WC séparé, 3 chambres au calme sur cour, une salle de bains."
Appartement,473 000 €,46.47 m²,2 pièces,75011 PARIS,"Rue de Malte, entre le Canal Saint Martin et le haut Marais, dans une copropriété récente avec gardien à demeure, 2 pièces à rafraîchir avec une vue ensoleillée et aérée. Il est composé d'une entrée, d'une cuisine dinatoire, d'une salle de bain, d'un toilette, d'une pièce de vie très lumineuse et d'une chambre."
Appartement,599 000 €,69 m²,3 pièces,75018 PARIS,"Marx Dormoy/Philippe de Girard dans un immeuble récent de standing, agréable 3 pièces avec un beau balcon filant. Un séjour avec une cuisine US aménagée et équipée, un dégagement avec de nombreux rangements, deux chambres de bonne taille, une salle d'eau et un WC séparé."
